Szerző:,Cím:,Abstract:,Kezwords-Szerző:,Keywords-GPT:,Évfolyam:
Bakó László Mihály,Open doors with human-machine interface: a new approach to password-free secure access,"Abstract
In this thesis, we have explored the possibility of using human-machine interfaces
as a new approach to password-free secure access and user authentication. In the pro-
posed approach, the active interface, which monitors some biometric process, serves as
a non-transferable authentication token based on a secure “dead man switch”. If the
connection is terminated, the system automatically revokes the privileges and logs the
user out. To avoid forgery and impersonation, the system uses a one-time key protected
communication protocol between the clients and the server managing access to resources.
In this research, we analyzed possible solutions based on the criteria of security,
convenience and cost-effectiveness, and implemented a system based on a comfortable
wearable visual cortex activity monitor and a low-cost heart rate monitoring system. The
completed systems were tested to assess their reliability and safety.
The results of the research show that the combination of non-transferable authenti-
cation tokens, biometrics and communication protocol offers a promising alternative to
password or simple token-based access control systems, as it improves security and allows
for more flexible security roles, such as temporary authorised security roles.",,"Human machine interfaces, Authentication, Biometrics, Communication protocol, Security, ",2023
Derzsi Daniel,Contract Creation and Property Sales Through the Web,"Abstract
In today’s fast-paced world, individuals and businesses engaged in real estate trans-
actions often encounter significant challenges when drafting property sale contracts. The
creation of these property sale contracts is an integral part of real estate transactions, in-
volving complex legalities and meticulous documentation. There is a pressing need for an
intuitive tool that can alleviate these complexities and facilitate the creation of accurate
and legally compliant contracts.
The aim of my thesis is two-fold. Firstly, I intend to create the basis of an online
platform to allow the automatic creation of contracts to facilitate secure property sales.
This includes the creation and planification of the necessary software architecture, the
creation of an easy to use administration interface, as well as the verbatim generation
and filling out of PDF documents using templates created by the administrators. Sec-
ondly, I intend to document the various stages (and possibilities) of the final deployment,
measured within real-world conditions.
The proposed website serves as a comprehensive platform, offering users a friendly
interface to generate legally binding contracts tailored to their specific requirements. By
eliminating the need for extensive legal knowledge or the assistance of costly attorneys,
the time and effort required to create a contract is greatly reduced.
Comparatively, governments worldwide have implemented similar software solu-
tions to address the challenges associated with property sale contracts. However, these
government-backed endeavours are often significantly handicapped by their perceived ob-
scurity and their convoluted design choices. This platform aims to provide users with a
unique and simplified experience that surpasses existing government initiatives.
In the beginning of the thesis we will discuss the various technologies employed to
create the proposed software solution. Afterwards, we will describe what the software
will do and how it will be expected to perform as part of a Software Requirements
Specification. A prospective user interface for the platform will be detailed following
the proposal of a potential software architecture and deployment layout. Finally, some
measurements will be presented to rationalize the decisions taken during the planning
stages of the software architecture.","Property contracts, Document templates, PDF document generation,Docker deployment, Serverless technologies.","Real estate transactions, Property sale contracts, Online platform, Software architecture, Legally compliant, ",2023
Csegzi Hunor,System to collect and elaborate data in superior education,"Abstract
In my dissertation, I developed a system to collect and elaborate data in superior
education to ensure quality. I started to develop a web application, in which it is possible
to create statements, modify tables containing data, delete, overwrite data, and upload
them in Excel format. The software helps anyone who has access to it, enter data, and
organize transparent data sets from displayed tables.
Priortothedevelopment,Iconsideredseveralalternativesolutions,butinconclusion,
the technology I chose proved to be the most effective. This technology is the RDLC
report, which was initially unknown to me as well, thus I learned and discovered it both
during the development process of my dissertation and during the writing process. The
most important of the many advantages of this solution is the easy editing, which can be
dynamically edited and implemented in XML format, but last but not least it is easier
to implement with the system packages I have chosen.
The development of the system was guided by opinions who has to elaborate data
to create reports. The elaboration of data has been, and will continue to be necessary, so
I kept it important throughout my software development to keep the project sustainable
and functional in the long run with minimal development. I created the system with the
information obtained during the research and taking into account the needs and requests
of the target user, as the most important thing is that the user community accepts it and
is happy to use it. This solid, analytical platform also simplifies the day-to-day tasks of
teachers involved in education, but provides a simple, clean, usable interface during the
years.
With the simplicity and efficiency in mind, I have written my dissertation, the main
functionality of which is the elaboration of reports, embedded in a user interface that
meets the current design conditions, where the competent user can understand the soft-
ware and easily find the desired information to access this function. Thus, the system and
website I have designed and implemented provides a user-friendly environment for both
clients and the designer.","RDLC, elaboration, web","system development, web application, data organization, RDLC report, user-friendly interface.",2023
Molnar Krisztian,Visualizations of large collections of images,"Abstract
Currently, we have access to large image collections both personally and in research.
Visualizing these collections can contribute to the discovery of latent patterns.
The topic of my thesis is the display and visualization of large image collections in
various layouts. The size of the image collections I used exceeds forty thousand images,
but the theoretical upper limit surpasses this by far.
I have developed an application that can display the images from the opened collec-
tion and arrange them based on extracted metadata, all within seconds.
My application is built on a client-server architecture. The server is written in the
Rust[rus23] programming language using the Axum framework. The client, running in the
browser, is built in TypeScript[typ23] and consists of two main parts. The desired layout
can be selected through a user interface created with the React[rea23] framework, and
this code is also responsible for the settings of the selected layout. The part responsible
for image display does not use a framework but follows a custom-designed architecture.
The WebGL[web23] library is used for rendering the images.
The application has gone through several development cycles. I will now present the
design decisions necessary for displaying image collections of this size and support them
with measurements.
Furthermore, I will showcase the layouts generated by the application for the collec-
tion I used.","images, display, collections, layouts, clustering","Large image collections, Visualization, Display, Layouts, Metadata, ",2023
Kolumban Attila,Rubik’s cube solver for phones,"Abstract
The Rubik’s Cube is one of the worlds most iconic and most interesting puzzle
game. The first Rubik’s Cube was made in the year 1974 by Rubik Ernő, who was a
Hungarian architect, sculptor and game designer. Since its inception, it became popular
worldwide, it entertains millions of people every day. Solving the Rubik’s Cube demands
attention, patients and strategic thinking of its user, but thanks to improvements of
modern technology, the way of thinking needed to solve the cube is a lot easier to learn.
Thanks to the improvements of our smart devices and automated robots, solving
the Rubik’s Cube reached new levels. These days Rubik’s Cube solver application are
available on personal computers, and also on smart phones, making the learning of new
solving algorithms a lot easier. Usually an application like this show a 3D representation
of a Rubik’s Cube on the screen of the device, which can be rotated by the user using
fingers or a mouse. The applications then calculate an optimal solution, and shows it to
the user. The user can copy these steps on his own cube, this way he can devolop his own
skills. Usually its a plus, if the application is not only able to show an optimal solution,
but also can show given solving algorithms, this way helping the user understand the
cube more.
My software is able to read in a real cube, using the camera of a smart device, this
way speeding up the process of inputting the state of the cube into the application. After
the scanning of the cube is done, the user can ask for an optimal solution, of which he
can go through step by step, or if he feels like it, he can try to solve the cube himself.
Aside from this, i wanted to implement a feature, where the user can learn given solving
algorithms. For this reason exists a separate menu, where the user can choose a solving
algorithm, and can see its steps on the cube.
The application was made in Unity, using C#, and for finding an optimal solution
i used Kociemba’s two step solving algorithm. This algorithm is well liked for its speed
and low solution step count.",,"Rubik's Cube, Solver application, Technology improvements, Smart devices, Solving algorithms, ",2023
Katona Andrea Izabella,Aplicarea comenzii vocale pentru  conducerea roboților mobili ,"Abstract 
 People have always been interested in robots. We often meet robots, not only in science, 
but also in various areas of life. Although we used to think of human-robot interaction as science 
fiction (e.g. R2D2 from the movie Star Wars), nowadays it has become more and more a reality. 
Since people's natural communication is through speech, it is not difficult to imagine 
control through speech. Voice control is an exciting topic that allows robots to be controlled by 
voice commands. There are different methods for this, however, research is still ongoing in the 
field. This branch of science can lead to many exciting realizations and applications in all areas of 
life (science, entertainment, industry, etc.). 
  The purpose of my work is to present the advantages and potential of voice control in 
controlling mobile robots. To this end, I will present an implementation that allows controlling a 
robot in a simulation environment as well as a physical robot with voice commands. Further on, 
you can read about the detailed implementation, the technologies used, as well as the results of the 
measurements, conclusions and further development possibilities.","mobile robots, voice control","Robots, Human-robot interaction, Voice control, Mobile robots, Implementation, Robots, Voice control, Implementation, ",2023
Gergely Zsolt,Uniscout: Aplicație mobilă pentru  organizarea Zilelor Porților  Deschise ,"Abstract 
 
The topic of my thesis is the design and implementation of a system that makes the management 
of events of university open days easier and more transparent for both the organizers and participants. 
University open days are an annual event aimed at promoting the university among high school 
students and providing insight into its operation for those interested. This is an extremely important 
process because an outsider can really only get a deeper look into university life here before deciding 
to apply. There are several tasks involved in organizing an event, such as managing information 
related to the event and participants, which are slow and cumbersome to solve with traditional 
methods, hence the need for a system that makes the whole process more effortless and faster. 
The aim of my thesis is to create a system that offers solutions to the aforementioned problems, 
using the advantages of two modern frameworks. My system makes it more accessible to transfer 
information related to events, save participant related data, and create statistics from the existing 
dataset for the organizers. 
The system consists of three parts. I implemented the mobile application using the Flutter 
framework, which must be installed on users' phones and is platform-independent. Here, depending 
on their role, users can register, create new events, modify existing events, sign up for events, and 
generate statistics. In the background, a Spring Boot application runs, which provides access to the 
data stored in the database and processes and saves the data generated by the mobile application. 
The third part is the cloud-based storage provided by Firebase, where I store the images, and the 
MySQL relational database, where I store all other data.","platform-independent, mobile application, Flutter, Spring Boot, event.","University open days, System design, Event management, Modern frameworks, Mobile application, ",2023
Szeibert Xaver,DEZVOLTAREA UNUI SISTEM  DE MANAGEMENT AL  ENERGIEI PENTRU CASELE  INTELIGENTE ,"Abstract 
 
 
In the modern and rapidly evolving world, there is electric technology behind all our 
needs, hobbies, and work, which we use comfortably and without problems. In current times, 
with the increase in inflation, the prices of all necessities have risen, especially electricity. 
Therefore, if we do not pay attention to our daily energy consumption and do not make changes 
in our energy usage habits, we can easily encounter financial difficulties. 
The aim of my thesis is to develop an IoT (Internet of Things) system that enables easy 
measurement and monitoring of energy consumption of electronic devices within a household. 
Additionally, the system is capable of monitoring the production of solar panels installed in the 
household. The data is stored in a database, allowing for future statistical analysis and insights. 
This provides a more accurate understanding of energy costs and helps optimize consumption 
while leveraging renewable energy sources. 
The different units communicate with each other through the MQTT protocol, where 
publishers (household appliances, solar panels) send sampled data to the broker (Raspberry Pi), 
where the data is processed, stored in a MongoDB database, and the processed data is sent to a 
mobile application via a REST API service.","IoT, Smart Energy meter, MQTT, Energy Management","Energy consumption, IoT system, Monitoring, Renewable energy sources, Data analysis, ",2023
Bako Jozsef,Proiectare și implementarea  unui robot de urmărire a unui  obiect cald ,"Abstract 
 
 
 Measuring temperature has always played an important role in human life due to the 
curiosity of it’s nature. With the advance of the world and the temperatures measuring 
technologies, this task has become a trivial problem, regardless of what we measure the 
temperature of. 
 The scope of this project is to create a heat follower robot and a mobile application for 
controlling it, which identifies the temperature extremes in a closed area and approaches it, as 
well. As for the app, my aim is to establish a Bluetooth connection between this and the robot 
and show a picture of it’s view to the user. Also, I want it to make manual control possible.","temperature measurement, bluetooth, application, robot control.","Temperature measuring , Heat follower robot , Mobile application , Bluetooth connection , Manual control, ",2023
Csiki Krisztina,  SISTEM INTERACTIV CU  SENZORI ,"Interactive sensor system 
Abstract 
Nowadays, using sensors has become so popular that we do not even notice how easy it is 
for us to measure the world around us. Today we have the possibility and the technology to 
measure the physical, chemical and the biological characteristics of the world around us. 
The goal of my thesis was to build a scalable system for sensors, created with the help of 
an Arduino, which helps in the integration of new sensors in the system for users, who may face 
a challenge when integrating a new sensor in an environment with Arduino and microcontrollers. 
At the beginning I had to create a text-based protocol, written with ASCII code, which 
provides for the user an interface for dynamic configuration of the sensors and for the collective 
data forwarding.  
Several different sensors have been integrated into the sensor system, with which it is 
possible to measure different physical quantities and monitor changes in values, but also an 
interface for the collected data. 
For the better understanding of the real-time data collected by the sensors with the help of 
the Arduino I have also created a desktop application,, through which the real-time data 
measured by the sensors connected to the Arduino can be displayed, and it is also possible to 
save and review the data. The communication between the application and the sensors is realized 
by serial communication. 
I designed the application to be used for laboratory purposes.","Arduino, protocol, sensors, desktop application","Interactive sensor system, Arduino, Sensors integration, Real-time data, Desktop application, ",2023
Ambrus Barna,Indicator inteligent pentru roller ,"Abstract 
This paper describes in detail a system and its architecture for managing direction change and 
braking signals on scooters and bicycles, using a sensor with an accelerometer and gyroscope on 
the back of the hand. The project aims to provide a solution for direction signals on the crank 
without removing the hand from the handlebars, thus avoiding the resulting accidents. The user is 
able to indicate a change of direction by gestures such as turning the hand sideways, so that it is 
not necessary to take the hand completely off the steering wheel, thus maintaining the balance of 
the vehicle. Brake signals are automatic as a result of acceleration sensing. The system uses two 
microcontrollers (ESP32 and ESP8266), one of which processes the sensor data, while the other 
runs a web server and lights the corresponding LEDs. The web server is responsible for the 
communication between the microcontrollers and also runs a web page that acts as a user interface. 
On the web page, active signals such as turn signals and brake signals are displayed and can be 
switched on and off. Communication between the different components is wireless using WiFi 
technology.","microcontroller, WiFi, gyroscope, accelerometer","Sensor  , Accelerometer  , Gyroscope  , Microcontrollers  , WiFi technology., ",2023
Soos Izabella,  SISTEM INTELIGENT DE IRIGARE  ȘI ILUMINARE ,"Abstract 
In human life, one of the most important and valuable things is time. In today's fast-paced 
world, events have become so accelerated that it is truly challenging to keep them under control 
and manage our time effectively. To save time, numerous smart devices and systems have 
emerged, making people's lives easier. We can even say that we are living in the era of smart 
systems. 
My thesis’ topic encompasses such a system. It helps us not only to save time, but also 
relieves us from a responsibility. This modern and innovative solution allows us to take care of 
our plants in the best possible way while minimizing the tasks of plant care and maximizing the 
health and beauty of our flowers. It assists in maintaining the plants in optimal condition, especially 
when we are not at home or don't have enough time for their care. The system's sensors and 
controllers monitor the environmental parameters of the plants, such as temperature, humidity, 
light intensity, and their watering needs. 
The smart flowerpot system automatically regulates watering, ensuring that the plants 
always receive the right amount of water at the right time. We no longer need to worry about 
overwatering or underwatering, as the system takes precise care of watering our flowers. 
Through an interactive and user interface, we can easily set the watering schedule, monitor 
the plants' condition, and track the environmental parameters. Whether we are at home or away, 
the system allows remote access, enabling us to stay connected with our flowers and intervene 
when necessary. 
For the control of the system, I have used an ESP32 microcontroller. The ESP32 is an 
extremely versatile and powerful platform that enables full control and monitoring of my smart 
flowerpot system.","user interface, smart system, microprocessor","time management, smart systems, plant care, automation, ESP32 microcontroller",2023
Czimbalmos Akos,  MODELAREA REȚELELOR DE  SENZORI FĂRĂ FIR  ,"Abstract 
 The purpose of the document Wireless Sensor Networks Modelling is to demonstrate the 
use of routing protocols in the design and operation of networks. Routing protocols play a key 
role in the selection and routing of data packets to reach their destination through the network. 
Routing protocols are based on different algorithms, which have different characteristics and 
operating principles. The aim of this documentation is to create a model to visualise the 
application of routing protocols, the propagation of packets and the evaluation of data. It also 
provides a means to compare the performance and efficiency of different routing protocols. 
Routing protocols are critical to the operation of wireless networks. A thorough understanding of 
the algorithms and their implementations will allow for a better understanding of the operation of 
networks, the detection of potential failures, and efficient planning, optimisation and operation. 
The documentation helps to understand the operation, advantages and limitations of different 
routing protocols, and helps to simulate networks by providing detailed code for simulations 
written in the OMNeT++ framework. Three routing protocols are described, a data-centric one 
(Gossiping), a hierarchical one (LEACH) and a location-based one (GAF), their comparison, 
conclusions drawn and the performance and efficiency of the routing protocols under study.","network, protocol, routing","Wireless Sensor Networks, Routing Protocols, Data Packets, Algorithms, Simulation, ",2023
Kantor Zsuzsa Krisztina,ANALIZA SEMNALELOR ECG PRIN  METODA SPECTOGRAMELOR  UTILIZATĂ ÎN DETECTAREA  ARITMIILOR CU AJUTORUL  REȚELELOR NEURONALE DE TIP DEEP LEARNING ,"Abstract 
 
Today, diagnostic methods in medicine are constantly evolving, and we can now apply 
techniques that were unimaginable before. Among the new possibilities and technological 
challenges, I aim to find solutions that can help us recognize and treat common cardiovascular 
diseases more effectively, thereby preventing premature or avoidable deaths. 
The main goal of my research is to develop new and advanced diagnostic systems specifically 
focused on the characteristics of cardiovascular diseases. These systems would enable more 
accurate and efficient diagnoses during the identification and treatment of these diseases. The 
foundation of my approach is the utilization of electrocardiography (ECG) signals in medicine. 
These signals provide precise and detailed information about the heart's electrical activity, 
making it possible to detect various heart diseases or other abnormalities. 
The first step involves preprocessing the signals, applying filtering and other normalization 
techniques. Then, I create an RGB color-channel image, a spectrogram. The spectrogram is a 
visual representation that shows the frequency spectrum of the signal over time. Different shades 
of color in the channels indicate the intensity of the frequencies, making it easier to analyze the 
structure and changes of the signal. This process helps extract essential information from the 
signals and reduces distortions caused by noise. 
These images serve as the input dataset for my deep learning-based training software, whose 
main task is to recognize four specific diseases. Therefore, my system will be able to identify 
patterns or subtle details that are not visible to the human eye, providing more accurate diagnoses 
for people. This can significantly contribute to improving healthcare outcomes and enhancing the 
quality of life.","deep learning, cardiovascular diseases, spectrogram, signal filtering, diseasediagnosis.","Cardiovascular diseases, Electrocardiography (ECG) signals, Diagnostic systems, Spectrogram, Deep learning, ",2023
