Szerző:,Cím:,Abstract:,Kezwords-Szerző:,Keywords-GPT:,Évfolyam:
Madaras Ervin,Recunoașterea automată a plăcilor PAL,"Abstract
The project aims to develop software for a wood processing company that can recognise
PAL boards by identifying and comparing different properties. This software will help the
operator of an automated crane to avoid cases where, due to human error, the supplier sends the
wrong type of PAL plate, or where, due to the same error, the woodworking company has
ordered the wrong type of PAL plate. These mistakes can lead to PAL boards, because of a
different type than the one set for the automated crane, being sent to the wrong place in the
warehouse or even the wrong type of board being processed.
The wood processing plant provided data with images of the PAL plates, and from this,
two classification algorithms were implemented. Since only one image sample of each PAL plate
exists in the database, traditional classifiers based on artificial intelligence cannot be used. For
this reason, the two algorithms that have been implemented extract features from each image and
use these features to compare the input sample with the images in the database for comparison.
One of these methods, which has been implemented, determines the dominant colors of
the images by clustering. By comparing dominant colors, the algorithm is able to determine how
similar two images are to each other. By calculating the Euclidean distance between the
dominant colors, it can give a value for how different the two images are from each other,
obviously the smaller the distance, the more similar the images are.
Another method that has been implemented is to split the images into segments and then
compute a histogram for each segment. These histograms are then concatenated to create a
feature vector for the images. It then compares the feature vectors using chi-square distance.
The conclusions are that the algorithms are sensitive to rotation. However, nice results
will be obtained if a segment of the images is created, or only one dominant color is selected and
compared.","dominant color, histogram, classification, similarity measure","PAL boards, Wood processing company, Software development, Classification algorithms, Feature extraction, ",2022
Nagy Andrea,Brain Computer Interface (BCI)  realizat cu inteligență artificială și  recunoașterea semnalului EEG    ,"Abstract 
The primary aim of the dissertation is to study the electrical activity of the brain, namely 
the EEG-type signals and to automatically recognize specific emotions. This requires sampled 
data collection and I used “Muse 2” headband in order to sample and collect this data. It was 
asked a woman and a man for the data collection and both of them made the same experiment. 
I processed the raw data, then I used it to build and teach an artificial neural network, which 
was created with the help of Tensorflow and Keras frameworks. 
 The secondary aim of the dissertation is to examine the spectrum of the samples and 
apply different transformations, then to compare them. Based on previous research I examined 
the processing of continuous and discrete signals and placed more emphasis on discrete 
transformations. 
 Based on my results (70-80% recognition efficiency), in order for the neural network 
to be as accurate as possible, it is necessary to collect more data, classify them into classes by 
providing them in a more optimal way. To reach this goal, in the future I would like to develop 
a set of rules from the collected data and to classify my data based on these rules, and so I hope 
to achieve greater recognition efficiency.","EEG, spectrogram, signal processing, Tensorflow, neural networks.","EEG signals, Emotion recognition, Muse 2 headband, Neural network, Recognition efficiency, ",2022
Kis Gerlinda Boglarka,Vizualizarea grafică a proceselor  termice din clădiri       ,"Abstract  
  
 In today's digital world, modern remote controlled devices have also appeared in our homes. 
These devices ensure the safety of our homes, we can monitor various household appliances 
remotely and parameterize the comfort functions of our home.  
The aim of this thesis is to design a universal graphical interface which can visualize the thermal 
parameters of a given building, the control of the of the buildings furnace is parameterizable and 
real-time feedback off the processes can be read from the interface.  
The tunable parameters necessary for the mathematical model of the control algorithm can be 
entered by the user through a proprietary user interface, where the user can choose the type of wall 
material, and also specify other parameters (windows, doors, number of heaters) that are stored in 
a database running on an external server. The user interface uses the TCP network communication 
protocol to communicate with the control system. The calculated control signals can be displayed 
in the user interface, and at the same time the thermal heat map of the building is also displayed.    
Within the framework of the thesis, the user interface was implemented, which is able to establish 
communication with a working temperature control system, the interface provides the possibility 
for parameterization of the specified building, and to simultaneously assign changing heat map 
and control options to the given building.  
With the help of the user interface, the user can display and parameterize various control 
algorithms and choose the most optimal one, thereby saving energy.","visual interface, display of optimal control, thermal change, heat map, TCPcommunication","Remote controlled devices, Graphical interface, Thermal parameters, User interface, Control algorithms, ",2022
Lukács Orsolya,BHEW Be Healthy Eat Wisely,"9
Abstract
Today, smartphones make most of our lives easier, as they allow us to access
services that embrace our day-to-day operations. These services are available through
a downloadable application, a website created by a specialized company. In many
cases, software can save energy and time. The need to manage time can also be
observed in the case of services that put our health and well-being first.
As part of my dissertation, I am developing a software that provides health
services. Important information is that the software is actually on-demand, serving a
Client. The Client's job is to advise on diet, to work as a dietitian in which she can use
the software. The implemented application, which allows the monitoring of clients,
the creation of recipes and diets, was created with the help of Flutter. We use the
real-time database provided by Firebase to store the data. The application is also
available to patients, where they can follow their diet, monitor their changes in body
size, and schedule appointments with their dietitian. The primary basis of the software
was to minimize the number of applications required to be used in the work of a
dietitian. Similar applications have been observed, as well as different parameters that
need to be considered when developing a medical application.
The Client also took part in the complete development of the software, and her
comments and needs were taken into account. The application is a version of the
expected software, for which there are still some development ideas, but for now, it
fully covers the main functionalities.","medical application development, dietitian, patient, flutter9","Smartphones, Software, Health services, Dietitian, Flutter, ",2022
Erdős Jozsef,APLICAȚIE DE COMANDĂ DE LA RESTAURANTE PENTRU DISPOZITIVE MOBILE,"Abstract
The new innovations of the 21st century are making our daily lives easier, one of them
being food ordering apps, which were mainly used during the quarantine period in our region.
In my thesis, I will compare several food ordering apps, their usage, and I will also present an
application developed by me, that has been in real use for more than three months in the
villages near Odorheiu Secuiesc, Cristuru Secuiesc and Gheorgheni.
I used several technologies to create the application. The restaurant's internal system
was written in Node.js/Express.js. The API that serves the mobile app was written in Node.js
and finally for the mobile application I used React Native.
In my thesis I will present in detail how the application works and how to use it. It is
important to mention that I wanted to create a user interface by using the knowledge I gained
at the university, which provides a ready-to-use system for the users, that is rather simple and
easy to use. Another interesting aspect is that I made the application available in small
villages where online food ordering was not yet available.",,"Food ordering apps, Thesis, Technology, User interface, Innovation, ",2022
Siko Zsolt Robert,Studiu comparativ a metodelor de  clasificare cu invatare supravegheata  aplicate în segmentarea imaginilor  medicale ,"Abstract 
 
 
 Along with the science of medicine, computer technology can be considered a 
unique technology, however, the last one is experiencing a very rapid development, with the 
emergence of more useful and newer information systems. 
The importance of information technology in medicine can not be ignored, because of its 
rapid development and a conscientious orientation, which offers a significant help in the 
field of medicine. 
Invented in the 1970s, the MRI scanner makes it possible to safely examine the human body 
without any surgery. The so-called MRI images are made, they are investigated, nowadays 
being segmented with the help of algorithms. 
 My paper approaches a segmentation system, the aim being to test seven different 
algorithms, so that the mentioned algorithms will learn from the data provided by the babies' 
brains, then they make segmentation and reach an accuracy of over 80%.  
Coordination is done on a graphics user platform, so that, in order to test the system, the user 
can give arbitrary parameters for the chosen algorithm. 
 Based on the tests, we found that among the tested methods, the AdaBoost and 
Random Forest algorithms showed the best performance and along with the appropriate 
settings they obtained an accuracy of about 83-84% 
 
 
 
 
 
 
9","magnetic resonance imaging, machine learning, MRI imagesegmentation, pattern recognition.","Information technology, Medicine, MRI scanner, Segmentation system, Algorithms, ",2022
Kencse Szabolcs,uSochool – The digital catalogue   ,"_____________________________________________________________________________  
 
 
 
Abstract 
The world is moving fast towards digitalization by taking huge steps in all areas of life and thus 
almost every person has now a smartphone. Nowadays, there are plenty of applications to facilitate 
our everyday tasks, however, in one of the most important areas, education, we still do not take 
advantage of the opportunities offered by these tools. 
The goal of my dissertation is to provide an alternative to the handwritten catalogue used in public 
education that makes it easy for all teachers, students, and parents to track student marks and 
absences and helps optimizing administration processes. A teacher can hold the catalogue of all 
the classes he teaches in his hand at the same time and note their grades at any time, as the physical 
limit, given by the fact that there is only one unique piece for each class, is eliminated. The students 
will also have the opportunity to view their marks and absences at any time without interrupting 
the classes and parents will be able to keep track of real data through their kid’s user as well. 
To implement this solution, I created a multiplatform application that is compatible with 
smartphones running iOS and Android, but also any device that has a web browser. 
3","digital, catalogue, web application, education","Digitalization, Education, Application, Catalogue, Smartphone, ",2022
Szalma Tamas Zsolt,Webshop scalabil bazat pe Kubernetes,"Abstract
In today’s world, websites have to meet more and more expectations, serving an increasing
number of users is one of the most important aspects of modern websites. A page may be
browsed by 100 people in one minute and increase to 100,000 in the next minute. A modern
website needs to sense this and increase or decrease the resources allocated, depending on the
load.
The dissertation presents a scalable web application based on Kubernetes, during the creation of
which I created a webshop, and then I containerized it and deployed it to a local Kubernetes
cluster.
The webshop allows you to browse and search for products belonging to different categories,
display a specific product in detail, add products to the cart, register, login and pay by credit
card.
I used Spring Boot framework for the server side of the application. On the client side I used the
Angular framework. For the database I used a relational MySQL database.
To implement the containerization, I used Docker to create the containers that are the basis for
deploying the application to the Kubernetes cluster. I solved the deployment to the Kubernetes
cluster with Minikube, which allowed me to use Kubernetes locally for free.
In the dissertation I write in detail about the technologies used, mainly about Kubernetes and
Docker, the implementation of functions, the architecture and the results achieved.","cloud, scalable, Kubernetes, webshop","Modern websites, Kubernetes, Webshop, Docker, Scalable web application, ",2022
Deák Adrienndokum,Remote control of industrial robots with Android application,"Abstract
Nowadays, IoT (Internet Of Things) technology-based systems are gaining more ground,
enabling the efficient remote control, monitoring, and management of industrial processes
with smart device applications. In the case of industrial software running on smart
devices, reliable monitoring, rapid intervention, and proper management of the access
control are critical. Hence, this kind of application development is a complex process.
Industrial robots have their own control devices to program and monitor, but these tools
are usually immovable. Therefore, in addition to these devices, mobile phone applications
can effectively serve as an extension.
This work aims to develop an open-source Android application that can be used to
remotely control robots used in the industry. The developed application can monitor
the motion of the robot based on video and sensor informations, it can send commands
and control scripts to the robot, and it ensures the manual control of the robot based on
video information. In addition to the aforementioned functionalities, the application can
analyze the remote control technique of the users. This module can help to evaluate and
educate manual robot control techniques.","remote control, Android application, robot control, IoT.","IoT technology , Industrial processes , Remote control , Smart devices, Robot control, ",2022
Rozsnyai Arnold Robert,JÁRMŰVEK ÚTVONALAINAK STATISZTIKAI FELDOLGOZÁSA,"Abstract
In recent years, there has been a rapid increase in demand for vehicles equipped with
GPS. As it becomes an increasing priority for people to get from one point to another as
smoothly as possible, it can be beneficial to be able to filter out the busier road sections. It can be
helpful for the vehicle owner to know as much retrievable information about the vehicle as
possible based on the route taken.
The aim of the dissertation is to process the routes of the vehicles in such a way that
conclusions can be drawn from them, with the help of which relevant data (average speed, curve
coordinates) can be filtered out. The available data set is made up of different data (coordinate,
speed, consumption, direction). The developed algorithm can be used to reduce the data set
without losing statistically important data.
The most important data contains the coordinates that result in a route change. The
solution is able to detect bends from which it can generate significant statistics (average speed in
a curve). As a result, it is able to compare different routes and suggest new ones.
The development takes place in ASP.NET Core Web App and is tested in xUnit, in which
map elements are displayed using Leaflet and OpenStreetMap.","data set, statistics, path","GPS, vehicle routes, data processing, algorithm development, route optimization",2022
Demény Székely Adorján,TESTAREA ȘI ACTUALIZAREA  AUTOMATĂ A SERVERULUI  NOMINATIM ,"Abstract 
 Nowadays, geopositioning can be done on even the smallest devices, such as a smart 
watch or a smart phone. Each of the GPS applications uses the reverse geocoding feature of the 
map application to give the user accurate information about their location. To be able to do this, 
the map application must be backed by a serious database that stores geographic data for millions 
of points around the world. 
There are many applications that can provide very accurate map data to users. The most known 
applications are Google Maps, Bing Maps, Apple Maps, and the open source OpenStreetMap. 
One of the great advantages of OpenStreetMap is that it is open source, but it is also one of it’s 
weaknesses, because being open source, anyone can update the data in its database. 
OpenStreetMap allows for local installation through software called Nominatim, this means that 
companies can become independent from big companies who provide Map APIs for huge 
amount of money. Installing such a server requires a huge amount of disk space, and the amount 
of data continues to grow after installation due to updates. 
The aim of this dissertation is to develop a software system that allows the Nominatim 
web server data to be updated automatically, but also allows the user to manage the update 
process. The software system consists of two main components, a web application that tests the 
data. A server collection that allows you to update the data in the database. The web application 
is an ASP.NET Core application implemented with an MVC architectural pattern. This testing 
application allows the user to test the differences between two Nominatim servers. The server 
collection consists of three ubuntu servers with Nominatim software installed. Their job is to 
update the data in the database.","Nominatim, automatic update, OSM database","Geopositioning, Reverse geocoding, Map applications, OpenStreetMap, Nominatim, ",2022
Lukacs Botond,TESTER DE COMPONENTE ELECTRONICE,"Abstract
In today’s world microcontroller system can be found in a lot of things and they have a big processing
capacity and can be used generally in a lot of different applications. They have a lot of functions, from
making a LED blink to automating complex systems. They also can be easily connected to external
components so this way they can be used in more ways.
For this cause this dissertation main goal it making a system which will be able to identify simple
electoronic components whith their aproximative values and their pinouts. In electoronics there are
a lot of electronic components, like resistors, capacitors, diodes and transistors. But when building
a circuit it is good to know what is the component and their pinout, which is more important on
semiconductors. In a lot of times the identifier values are unreadable or there is no datasheet avabile
so it is hard to idnetify the component. For this purpose the ""electronic component teszter"" was made
which automaticall identif and outputs the component values or outputs if if failed to identify the
component. The process if fully automatic, only the component need to be connected to the tester
socket and togle switch or it automatically starts when it is connected to power.
The dissertation will cover microcontroller applications and their design for component recogniti-
on and measurement.","microcontroller, transistor, identifying9","microcontroller, electronic components, identification, automatic, application",2022
Molnar Tamas,Holiday management application,"Abstract
The topic of my thesis is the presentation of a web application that makes it easier
to manage the days off of employees within a company. In a larger company, as the
number of employees increases, it becomes more and more difficult for the management
to handle the allocation of days off. At the same time, employees also face difficulties in
the application process, which is not the same for all workplaces and may even vary from
time to time within a company. The application aims to overcome these problems.
To achieve this goal, I decided to create a web application. One of the main aspects
of the application is to make everyone’s job easier, so it should also be easy to access,
without having to go through the installation process on each device separately. At the
same time, the development does not have to take into account the specific requirements
of different operating systems. All you need is a device that can connect to the Internet
and has a browser.
In this thesis I will describe the architecture of the application, how it works and the
technologies used to implement it. I will describe the frameworks used, their characteris-
tics and how they have contributed to the implementation of my application.
Technologyhasbeenapartofoureverydaylifeforquitesometimenow,hencesimilar
applications already exist. Therefore, I think it is important to mention and compare my
own application with these and highlight why my application is more suitable for a
company.
Finally, I will summarise the features implemented in the application and the oppor-
tunities they offer. In addition, I consider it important to set goals for the future so that
the application can meet the expectations that will arise in the meantime and, by adding
further features, make the work of the company and its employees even easier.",,"web application, employees, management, technology, implementation.",2021
Toducz Endre,Algorithm analysis software based on graph theoretical aspects,"Abstract
The computer science gives you the opportunity to immerse yourself in the beauty of
algorithms. As a beginner, we write and test short codes and browse the implementation
of famous algorithms, learning about their logic’s beauty. During our studies, we are
quickly introduced to basic ordering algorithms and graph theory.
Whiledissectingtheorderingalgorithms, aninterestingquestionarose, andtheanswer
was obtained by looking at an emerging problem from a graph-theoretic point of view.
The problem led us to start investigating ordering algorithms using graph theory. This
led me to develop a software to investigate algorithms using graph theory.
In this thesis, I present the process of developing an algorithm testing software tool
using different programming techniques.The paper includes the theoretical background,
design and implementation of the software tool.
The tool will be useful for novice programmers and for enthusiastic individuals too
who want to gain insight into basic ordering algorithms and other small pieces of code
by using graphs.
The tool can be used as a teaching aid, as it facilitates the understanding of the
algorithm, and can also be used in teaching graph theory.","violence, face, sound, motion detection, artificial intelligence.","Computer Science, Algorithms, Graph Theory, Software Development, Teaching Aid, ",2021
Felmeri Zsolt,Keylogger,"Abstract
The aim of my thesis is the implementation of a software-based keylogger which has
more functionalities than an avrage keylogger. Worldwide there is at least one computer
or machine running an operating system in almost every building, as we know. Therefor,
care must be taken in order not to be a victim of a virtual attack.
After we entered the world of the Internet, there is a growing threat from malware.
Therefore, I tried to develop a software-based keylogger from the persppective of an
attacker, i.e hacker. However, I was not only interested in the perspective of an attacker,
but I also wanted how I can prevent them. So anti-virus programs prevent keyloggers
from being installed on systems. During my research, I noticed that keyloggers are also
used in companies to monitor their computer systems.
During planning, the project had to be divided into two parts. So two softwares had
to be designed: one will run on the hacker’s side and monitor the victim’s keystrokes and
the other one ill be installed on the victim’s operating system. The victim side sends the
data and the hacker side receives it. The data travels over the network, so it is a good
idea to encrypt the packets. For example, with well-monitored system packets traveling
on the network can be tracked. The purpose of encryption is to prevent anyone from
interpeting the content of a package.
I used common operating systems for testing, both on virtual machines and real
machinesaswell.Mygoalwastocapturesensitivedatafromthevictimsuchaspasswords.
In conclusion, we determine that on which operating system it is possible to obtain the
login password from the user and on which operating systems this process fails.","keylogger, malware, hacker","Keylogger implementation, Cybersecurity, Malware threat, Encryption, Operating systems, ",2021
